{
  "layout_id": "slk-landmarks-v1",
  "n_landmarks": 146,
  "groups": [
    {
      "name": "hand_left",
      "source": "hand_left",
      "indices": [
        0,
        1,
        2,
        3,
        4,
        5,
        6,
        7,
        8,
        9,
        10,
        11,
        12,
        13,
        14,
        15,
        16,
        17,
        18,
        19,
        20
      ]
    },
    {
      "name": "hand_right",
      "source": "hand_right",
      "indices": [
        0,
        1,
        2,
        3,
        4,
        5,
        6,
        7,
        8,
        9,
        10,
        11,
        12,
        13,
        14,
        15,
        16,
        17,
        18,
        19,
        20
      ]
    },
    {
      "name": "pose",
      "source": "pose",
      "indices": [
        0,
        2,
        5,
        7,
        8,
        11,
        12,
        13,
        14,
        15,
        16
      ]
    },
    {
      "name": "face_lips",
      "source": "face",
      "indices": [
        0,
        13,
        14,
        17,
        37,
        39,
        40,
        61,
        78,
        80,
        81,
        82,
        84,
        87,
        88,
        91,
        95,
        146,
        178,
        181,
        185,
        191,
        267,
        269,
        270,
        291,
        308,
        310,
        311,
        312,
        314,
        317,
        318,
        321,
        324,
        375,
        402,
        405,
        409,
        415
      ]
    },
    {
      "name": "face_left_eyebrow",
      "source": "face",
      "indices": [
        276,
        282,
        283,
        285,
        293,
        295,
        296,
        300,
        334,
        336
      ]
    },
    {
      "name": "face_right_eyebrow",
      "source": "face",
      "indices": [
        46,
        52,
        53,
        55,
        63,
        65,
        66,
        70,
        105,
        107
      ]
    },
    {
      "name": "face_left_eye",
      "source": "face",
      "indices": [
        249,
        263,
        362,
        373,
        374,
        380,
        381,
        382,
        384,
        385,
        386,
        387,
        388,
        390,
        398,
        466
      ]
    },
    {
      "name": "face_right_eye",
      "source": "face",
      "indices": [
        7,
        33,
        133,
        144,
        145,
        153,
        154,
        155,
        157,
        158,
        159,
        160,
        161,
        163,
        173,
        246
      ]
    },
    {
      "name": "face_nose_tip",
      "source": "face",
      "indices": [
        1
      ]
    }
  ],
  "anchors": {
    "left_shoulder": 47,
    "right_shoulder": 48
  }
}
